{
  "artifact_id": "skill/create-pillars-document",
  "artifact_version": "1.1.0",
  "compatibility": {
    "required_tools": []
  },
  "distribution_id": "distribution/create-pillars-document",
  "generated_paths": [
    "dist/skills/create-pillars-document/SKILL.md",
    "dist/skills/create-pillars-document/evals/evals.json",
    "dist/skills/create-pillars-document/references/examples-and-antipatterns.md",
    "dist/skills/create-pillars-document/references/validation-checklist.md",
    "dist/skills/create-pillars-document/templates/PILLARS.template.md",
    "dist/skills/create-pillars-document/distribution-manifest.v1.json"
  ],
  "generator": "library/organization/skills/build-distributions.py",
  "schema_version": "aether.distribution-manifest/v1",
  "source_digest": {
    "algorithm": "sha256-utf8-lf",
    "value": "105bf40e7279590dac53c202cf948665a26f49c530af6585b8a1477de67cbeab"
  }
}
