{
  "artifact_id": "skill/create-architecture-document",
  "artifact_version": "1.1.0",
  "compatibility": {
    "required_tools": []
  },
  "distribution_id": "distribution/create-architecture-document",
  "generated_paths": [
    "dist/skills/create-architecture-document/SKILL.md",
    "dist/skills/create-architecture-document/evals/evals.json",
    "dist/skills/create-architecture-document/references/authoring-guide.md",
    "dist/skills/create-architecture-document/references/validation-checklist.md",
    "dist/skills/create-architecture-document/templates/ARCHITECTURE.template.md",
    "dist/skills/create-architecture-document/distribution-manifest.v1.json"
  ],
  "generator": "library/organization/skills/build-distributions.py",
  "schema_version": "aether.distribution-manifest/v1",
  "source_digest": {
    "algorithm": "sha256-utf8-lf",
    "value": "81b647f97f7a6f1f6f76f57b921e380e745dcc5d0446ccbe050978dbc0d0b1c2"
  }
}
