{
  "artifact_id": "skill/create-foundations-document",
  "artifact_version": "1.1.0",
  "compatibility": {
    "required_tools": []
  },
  "distribution_id": "distribution/create-foundations-document",
  "generated_paths": [
    "dist/skills/create-foundations-document/SKILL.md",
    "dist/skills/create-foundations-document/evals/evals.json",
    "dist/skills/create-foundations-document/references/authoring-guide.md",
    "dist/skills/create-foundations-document/references/validation-checklist.md",
    "dist/skills/create-foundations-document/templates/FOUNDATIONS.template.md",
    "dist/skills/create-foundations-document/distribution-manifest.v1.json"
  ],
  "generator": "library/organization/skills/build-distributions.py",
  "schema_version": "aether.distribution-manifest/v1",
  "source_digest": {
    "algorithm": "sha256-utf8-lf",
    "value": "f85426189722e72d54d38f0180a89aab3ea6874750c862e9437eb5f5dd9c2fd1"
  }
}
