{
  "artifact_id": "skill/create-ai-constitution-document",
  "artifact_version": "1.1.0",
  "compatibility": {
    "required_tools": []
  },
  "distribution_id": "distribution/create-ai-constitution-document",
  "generated_paths": [
    "dist/skills/create-ai-constitution-document/SKILL.md",
    "dist/skills/create-ai-constitution-document/evals/evals.json",
    "dist/skills/create-ai-constitution-document/references/examples-and-antipatterns.md",
    "dist/skills/create-ai-constitution-document/references/validation-checklist.md",
    "dist/skills/create-ai-constitution-document/templates/AI_CONSTITUTION.template.md",
    "dist/skills/create-ai-constitution-document/distribution-manifest.v1.json"
  ],
  "generator": "library/organization/skills/build-distributions.py",
  "schema_version": "aether.distribution-manifest/v1",
  "source_digest": {
    "algorithm": "sha256-utf8-lf",
    "value": "2d9adf0c90ff7c96c62a23527053ec856262698b30473a296d4ab9578ece6ec7"
  }
}
