{
  "artifact_id": "skill/create-principles-document",
  "artifact_version": "1.1.0",
  "compatibility": {
    "required_tools": []
  },
  "distribution_id": "distribution/create-principles-document",
  "generated_paths": [
    "dist/skills/create-principles-document/SKILL.md",
    "dist/skills/create-principles-document/evals/evals.json",
    "dist/skills/create-principles-document/references/examples-and-antipatterns.md",
    "dist/skills/create-principles-document/references/validation-checklist.md",
    "dist/skills/create-principles-document/templates/PRINCIPLES.template.md",
    "dist/skills/create-principles-document/distribution-manifest.v1.json"
  ],
  "generator": "library/organization/skills/build-distributions.py",
  "schema_version": "aether.distribution-manifest/v1",
  "source_digest": {
    "algorithm": "sha256-utf8-lf",
    "value": "39497e22891b856e87b652f67e749088672021199c8de7425b683251c1eda234"
  }
}
