{
  "artifact_id": "skill/repository-cleanup",
  "artifact_version": "1.1.0",
  "compatibility": {
    "required_tools": []
  },
  "distribution_id": "distribution/repository-cleanup",
  "generated_paths": [
    "dist/skills/repository-cleanup/SKILL.md",
    "dist/skills/repository-cleanup/evals/evals.json",
    "dist/skills/repository-cleanup/references/classification-checklist.md",
    "dist/skills/repository-cleanup/templates/CLEANUP_PLAN.template.md",
    "dist/skills/repository-cleanup/distribution-manifest.v1.json"
  ],
  "generator": "library/organization/skills/build-distributions.py",
  "schema_version": "aether.distribution-manifest/v1",
  "source_digest": {
    "algorithm": "sha256-utf8-lf",
    "value": "93c67edb91f3936a388f6c14d18061df7997a77920b85a6464bb49b0cb5754f5"
  }
}
