{
  "artifact_id": "skill/create-decisions-document",
  "artifact_version": "2.1.0",
  "compatibility": {
    "required_tools": []
  },
  "distribution_id": "distribution/create-decisions-document",
  "generated_paths": [
    "dist/skills/create-decisions-document/SKILL.md",
    "dist/skills/create-decisions-document/evals/evals.json",
    "dist/skills/create-decisions-document/evals/fixtures/existing-decision-reference.json",
    "dist/skills/create-decisions-document/evals/fixtures/historical-reconstruction-with-gaps.json",
    "dist/skills/create-decisions-document/evals/fixtures/later-outcome-correction.json",
    "dist/skills/create-decisions-document/evals/fixtures/legacy-index-migration.json",
    "dist/skills/create-decisions-document/evals/fixtures/missing-skill-and-validator.json",
    "dist/skills/create-decisions-document/evals/fixtures/new-proposal.json",
    "dist/skills/create-decisions-document/evals/fixtures/proposed-supersession.json",
    "dist/skills/create-decisions-document/evals/fixtures/routine-implementation.json",
    "dist/skills/create-decisions-document/evals/fixtures/supported-historical-record.json",
    "dist/skills/create-decisions-document/evals/goldens/existing-decision-reference.golden.txt",
    "dist/skills/create-decisions-document/evals/goldens/historical-reconstruction-with-gaps.golden.txt",
    "dist/skills/create-decisions-document/evals/goldens/later-outcome-correction.golden.txt",
    "dist/skills/create-decisions-document/evals/goldens/legacy-index-migration.golden.txt",
    "dist/skills/create-decisions-document/evals/goldens/missing-skill-and-validator.golden.txt",
    "dist/skills/create-decisions-document/evals/goldens/new-proposal.golden.txt",
    "dist/skills/create-decisions-document/evals/goldens/proposed-supersession.golden.txt",
    "dist/skills/create-decisions-document/evals/goldens/routine-implementation.golden.txt",
    "dist/skills/create-decisions-document/evals/goldens/supported-historical-record.golden.txt",
    "dist/skills/create-decisions-document/references/adoption.md",
    "dist/skills/create-decisions-document/references/decision-record-guide.md",
    "dist/skills/create-decisions-document/references/four-digit-migration.md",
    "dist/skills/create-decisions-document/references/policy-selection.json",
    "dist/skills/create-decisions-document/references/validation-checklist.md",
    "dist/skills/create-decisions-document/templates/ADR.template.md",
    "dist/skills/create-decisions-document/templates/DECISIONS.template.md",
    "dist/skills/create-decisions-document/templates/INDEX.template.md",
    "dist/skills/create-decisions-document/templates/MIGRATION.template.md",
    "dist/skills/create-decisions-document/templates/policy-reference.template.json",
    "dist/skills/create-decisions-document/distribution-manifest.v1.json"
  ],
  "generator": "library/organization/skills/build-distributions.py",
  "schema_version": "aether.distribution-manifest/v1",
  "source_digest": {
    "algorithm": "sha256-utf8-lf",
    "value": "fd148c4f9475928c2182e2f2cd68b54625cbcd8e692da48aab6c27784b8113d0"
  }
}
