{
  "artifact_id": "skill/social-surface-specs",
  "artifact_version": "1.0.1",
  "compatibility": {
    "required_tools": []
  },
  "distribution_id": "distribution/social-surface-specs",
  "generated_paths": [
    "dist/skills/social-surface-specs/SKILL.md",
    "dist/skills/social-surface-specs/evals/evals.json",
    "dist/skills/social-surface-specs/references/catalog-contract.md",
    "dist/skills/social-surface-specs/references/freshness-and-rights.md",
    "dist/skills/social-surface-specs/templates/social-surface-review.md",
    "dist/skills/social-surface-specs/references/social-surface-catalog.v1.json",
    "dist/skills/social-surface-specs/scripts/query-social-surfaces.py",
    "dist/skills/social-surface-specs/distribution-manifest.v1.json"
  ],
  "generator": "library/organization/skills/build-distributions.py",
  "schema_version": "aether.distribution-manifest/v1",
  "source_digest": {
    "algorithm": "sha256-utf8-lf",
    "value": "33c29870108626a5f73267f97120d389447f52c96bb7d2587feeb6519b724b33"
  }
}
