{
  "artifact_id": "skill/create-personal-model-document",
  "artifact_version": "1.1.0",
  "compatibility": {
    "required_tools": []
  },
  "distribution_id": "distribution/create-personal-model-document",
  "generated_paths": [
    "dist/skills/create-personal-model-document/SKILL.md",
    "dist/skills/create-personal-model-document/evals/evals.json",
    "dist/skills/create-personal-model-document/references/human-model-safeguards.md",
    "dist/skills/create-personal-model-document/references/validation-checklist.md",
    "dist/skills/create-personal-model-document/templates/PERSONAL_MODEL.template.md",
    "dist/skills/create-personal-model-document/distribution-manifest.v1.json"
  ],
  "generator": "library/organization/skills/build-distributions.py",
  "schema_version": "aether.distribution-manifest/v1",
  "source_digest": {
    "algorithm": "sha256-utf8-lf",
    "value": "07092ba1d697d46ee50a0c8657dd26e22980bcff60501138daa5554861a343e9"
  }
}
