{
  "artifact_id": "skill/create-ontology-document",
  "artifact_version": "1.1.0",
  "compatibility": {
    "required_tools": []
  },
  "distribution_id": "distribution/create-ontology-document",
  "generated_paths": [
    "dist/skills/create-ontology-document/SKILL.md",
    "dist/skills/create-ontology-document/evals/evals.json",
    "dist/skills/create-ontology-document/references/concept-modeling-guide.md",
    "dist/skills/create-ontology-document/references/validation-checklist.md",
    "dist/skills/create-ontology-document/templates/ONTOLOGY.template.md",
    "dist/skills/create-ontology-document/distribution-manifest.v1.json"
  ],
  "generator": "library/organization/skills/build-distributions.py",
  "schema_version": "aether.distribution-manifest/v1",
  "source_digest": {
    "algorithm": "sha256-utf8-lf",
    "value": "53790a0eda66167397f560d563a8f9409d85eb65bca8d418b393184a00bf6888"
  }
}
