{
  "artifact_id": "skill/create-vision-document",
  "artifact_version": "1.1.0",
  "compatibility": {
    "required_tools": []
  },
  "distribution_id": "distribution/create-vision-document",
  "generated_paths": [
    "dist/skills/create-vision-document/SKILL.md",
    "dist/skills/create-vision-document/evals/evals.json",
    "dist/skills/create-vision-document/references/examples-and-antipatterns.md",
    "dist/skills/create-vision-document/references/validation-checklist.md",
    "dist/skills/create-vision-document/templates/VISION.template.md",
    "dist/skills/create-vision-document/distribution-manifest.v1.json"
  ],
  "generator": "library/organization/skills/build-distributions.py",
  "schema_version": "aether.distribution-manifest/v1",
  "source_digest": {
    "algorithm": "sha256-utf8-lf",
    "value": "bd35dcf32191971960fea8bc2164c6d7335829974e54989add6ac9a5de9815ba"
  }
}
