{
  "artifact_id": "skill/architecture-authoring",
  "artifact_version": "1.1.0",
  "compatibility": {
    "required_tools": []
  },
  "distribution_id": "distribution/architecture-authoring",
  "generated_paths": [
    "dist/skills/architecture-authoring/SKILL.md",
    "dist/skills/architecture-authoring/evals/evals.json",
    "dist/skills/architecture-authoring/references/document-sequencing.md",
    "dist/skills/architecture-authoring/references/relationship-model.md",
    "dist/skills/architecture-authoring/references/validation-checklist.md",
    "dist/skills/architecture-authoring/templates/architecture-document.template.md",
    "dist/skills/architecture-authoring/distribution-manifest.v1.json"
  ],
  "generator": "library/organization/skills/build-distributions.py",
  "schema_version": "aether.distribution-manifest/v1",
  "source_digest": {
    "algorithm": "sha256-utf8-lf",
    "value": "eeb8e5c9be4e7950250d44af26e5e5e2623cd82e575409b3919a4f2424b47666"
  }
}
