{
  "artifact_id": "specification/architecture-purpose",
  "artifact_version": "1.0.0",
  "compatibility": {
    "required_tools": []
  },
  "distribution_id": "distribution/architecture-purpose",
  "generated_paths": [
    "dist/specs/architecture-purpose.spec.md"
  ],
  "generator": "aether-catalog v1",
  "schema_version": "aether.distribution-manifest/v1",
  "source_digest": {
    "algorithm": "sha256-utf8-lf",
    "value": "2222222222222222222222222222222222222222222222222222222222222222"
  }
}
