{
  "artifact_id": "skill/implementation-planning",
  "artifact_version": "1.1.0",
  "compatibility": {
    "required_tools": []
  },
  "distribution_id": "distribution/implementation-planning",
  "generated_paths": [
    "dist/skills/implementation-planning/SKILL.md",
    "dist/skills/implementation-planning/evals/evals.json",
    "dist/skills/implementation-planning/references/phase-design-checklist.md",
    "dist/skills/implementation-planning/templates/IMPLEMENTATION_PLAN.template.md",
    "dist/skills/implementation-planning/distribution-manifest.v1.json"
  ],
  "generator": "library/organization/skills/build-distributions.py",
  "schema_version": "aether.distribution-manifest/v1",
  "source_digest": {
    "algorithm": "sha256-utf8-lf",
    "value": "ca1d5ce91248d32eb2063aeaf13260c82f478eb7bd3286ecfe339d7fb778c9fb"
  }
}
