{
  "artifact_id": "skill/create-system-document",
  "artifact_version": "1.1.0",
  "compatibility": {
    "required_tools": []
  },
  "distribution_id": "distribution/create-system-document",
  "generated_paths": [
    "dist/skills/create-system-document/SKILL.md",
    "dist/skills/create-system-document/evals/evals.json",
    "dist/skills/create-system-document/references/authoring-guide.md",
    "dist/skills/create-system-document/references/validation-checklist.md",
    "dist/skills/create-system-document/templates/SYSTEM.template.md",
    "dist/skills/create-system-document/distribution-manifest.v1.json"
  ],
  "generator": "library/organization/skills/build-distributions.py",
  "schema_version": "aether.distribution-manifest/v1",
  "source_digest": {
    "algorithm": "sha256-utf8-lf",
    "value": "9916c1bf9f98fed8fae3431d7922200daeaa007f33a4588bf10430cef6b8c92f"
  }
}
